{
 "spec_version": 1,
 "id": "flow09",
 "flow": "Without logging in, open bob's profile; it lists his three articles.",
 "steps": [
  {
   "action": "goto",
   "url": "/#/profile/bob"
  },
  {
   "action": "goto",
   "url": "/#/profile/bob"
  },
  {
   "action": "expect",
   "target": {
    "role": "heading",
    "name": "bob"
   },
   "assert": "visible"
  },
  {
   "action": "expect",
   "target": {
    "role": "heading",
    "name": "Bob's post 3"
   },
   "assert": "visible"
  },
  {
   "action": "expect",
   "target": {
    "role": "heading",
    "name": "Bob's post 2"
   },
   "assert": "visible"
  },
  {
   "action": "expect",
   "target": {
    "text": "Post 3 by bob"
   },
   "assert": "visible"
  }
 ]
}