{
 "spec_version": 1,
 "id": "flow04",
 "flow": "As alice, publish a new article with a title, description, body and two tags; the article page then shows the title.",
 "steps": [
  {
   "action": "goto",
   "url": "/#/login"
  },
  {
   "action": "fill",
   "target": {
    "role": "textbox",
    "name": "Email"
   },
   "value": "alice@conduit.test"
  },
  {
   "action": "fill",
   "target": {
    "role": "textbox",
    "name": "Password"
   },
   "value": {
    "$secret": "ALICE_PASSWORD"
   }
  },
  {
   "action": "click",
   "target": {
    "role": "button",
    "name": "Login"
   }
  },
  {
   "action": "wait_for",
   "target": {
    "role": "button",
    "name": "Your Feed"
   },
   "state": "visible"
  },
  {
   "action": "goto",
   "url": "/#/editor"
  },
  {
   "action": "fill",
   "target": {
    "role": "textbox",
    "name": "Article Title"
   },
   "value": "My New Article"
  },
  {
   "action": "fill",
   "target": {
    "role": "textbox",
    "name": "What's this article about?"
   },
   "value": "This is my new article"
  },
  {
   "action": "fill",
   "target": {
    "role": "textbox",
    "name": "Write your article (in markdown)"
   },
   "value": "This is my new article body"
  },
  {
   "action": "fill",
   "target": {
    "role": "textbox",
    "name": "Enter tags"
   },
   "value": "tag1,tag2"
  },
  {
   "action": "click",
   "target": {
    "role": "button",
    "name": "Publish Article"
   }
  },
  {
   "action": "expect",
   "target": {
    "role": "heading",
    "name": "My New Article"
   },
   "assert": "visible"
  },
  {
   "action": "expect",
   "target": {
    "text": "October 4, 2026"
   },
   "assert": "visible"
  },
  {
   "action": "expect",
   "target": {
    "text": "This is my new article body"
   },
   "assert": "visible"
  },
  {
   "action": "expect",
   "target": {
    "text": "tag1"
   },
   "assert": "visible"
  }
 ]
}