{
 "spec_version": 1,
 "id": "flow06",
 "steps": [
  {
   "action": "goto",
   "url": "/#/"
  },
  {
   "action": "click",
   "target": {
    "role": "button",
    "name": "react"
   }
  },
  {
   "action": "expect",
   "assert": "url",
   "value": "/#/article?tag=react"
  },
  {
   "action": "expect",
   "assert": "visible",
   "target": {
    "role": "heading",
    "name": "Alice's post 2"
   }
  },
  {
   "action": "expect",
   "assert": "visible",
   "target": {
    "role": "heading",
    "name": "Bob's post 1"
   }
  },
  {
   "action": "expect",
   "assert": "visible",
   "target": {
    "role": "heading",
    "name": "Dave's post 2"
   }
  }
 ],
 "flow": "On the home page, click the 'react' tag under Popular Tags; the feed then only lists articles tagged 'react'."
}