{
 "spec_version": 1,
 "id": "flow10",
 "flow": "As alice, change her bio in settings to some generated text; her profile page then shows that bio.",
 "steps": [
  {
   "action": "goto",
   "url": "/#/login"
  },
  {
   "action": "fill",
   "target": {
    "role": "textbox",
    "name": "Email"
   },
   "value": "alice@conduit.test"
  },
  {
   "action": "fill",
   "target": {
    "role": "textbox",
    "name": "Password"
   },
   "value": {
    "$secret": "ALICE_PASSWORD"
   }
  },
  {
   "action": "click",
   "target": {
    "role": "button",
    "name": "Login"
   }
  },
  {
   "action": "wait_for",
   "target": {
    "role": "button",
    "name": "Your Feed"
   },
   "state": "visible"
  },
  {
   "action": "goto",
   "url": "/#/"
  },
  {
   "action": "goto",
   "url": "/#/settings"
  },
  {
   "action": "fill",
   "target": {
    "role": "textbox",
    "name": "Short bio about you"
   },
   "value": {
    "$faker": "lorem.sentence",
    "as": "gen1"
   }
  },
  {
   "action": "click",
   "target": {
    "role": "button",
    "name": "Update Settings"
   }
  },
  {
   "action": "goto",
   "url": "/#/profile/alice"
  },
  {
   "action": "expect",
   "target": {
    "role": "heading",
    "name": "alice"
   },
   "assert": "visible"
  },
  {
   "action": "expect",
   "target": {
    "role": "heading",
    "name": "Paxton_Wintheiser76"
   },
   "assert": "visible"
  },
  {
   "action": "expect",
   "target": {
    "text": "Pecus defleo cedo audacia tersus provident."
   },
   "assert": "visible"
  },
  {
   "action": "expect",
   "target": {
    "text": "caecus"
   },
   "assert": "visible"
  }
 ]
}