{
 "spec_version": 1,
 "id": "flow03",
 "steps": [
  {
   "action": "goto",
   "url": "/#/register"
  },
  {
   "action": "fill",
   "target": {
    "role": "textbox",
    "name": "Your Name"
   },
   "value": {
    "$faker": "internet.username",
    "as": "name"
   }
  },
  {
   "action": "fill",
   "target": {
    "role": "textbox",
    "name": "Email"
   },
   "value": {
    "$faker": "internet.email",
    "as": "email"
   }
  },
  {
   "action": "fill",
   "target": {
    "role": "textbox",
    "name": "Password"
   },
   "value": {
    "$faker": "internet.password",
    "as": "password"
   }
  },
  {
   "action": "click",
   "target": {
    "role": "button",
    "name": "Sign up"
   }
  },
  {
   "action": "expect",
   "assert": "visible",
   "target": {
    "role": "textbox",
    "name": "Your Name"
   }
  },
  {
   "action": "expect",
   "assert": "visible",
   "target": {
    "role": "textbox",
    "name": "Email"
   }
  },
  {
   "action": "expect",
   "assert": "visible",
   "target": {
    "role": "textbox",
    "name": "Password"
   }
  },
  {
   "action": "expect",
   "assert": "visible",
   "target": {
    "role": "button",
    "name": "Sign up"
   }
  }
 ],
 "flow": "Sign up a brand-new user with generated data; afterwards the navigation bar shows the new username."
}