{
 "spec_version": 1,
 "id": "flow10",
 "steps": [
  {
   "action": "goto",
   "url": "/#/login"
  },
  {
   "action": "fill",
   "target": {
    "role": "textbox",
    "name": "Email"
   },
   "value": "alice@conduit.test"
  },
  {
   "action": "fill",
   "target": {
    "role": "textbox",
    "name": "Password"
   },
   "value": {
    "$secret": "ALICE_PASSWORD"
   }
  },
  {
   "action": "click",
   "target": {
    "role": "button",
    "name": "Login"
   }
  },
  {
   "action": "wait_for",
   "target": {
    "role": "button",
    "name": "Your Feed"
   },
   "state": "visible"
  },
  {
   "action": "goto",
   "url": "/#/settings"
  },
  {
   "action": "fill",
   "target": {
    "role": "textbox",
    "name": "Short bio about you"
   },
   "value": {
    "$faker": "lorem.sentence"
   }
  },
  {
   "action": "click",
   "target": {
    "role": "button",
    "name": "Update Settings"
   }
  },
  {
   "action": "goto",
   "url": "/#/profile/alice"
  },
  {
   "action": "expect",
   "assert": "visible",
   "target": {
    "role": "heading",
    "name": "alice"
   }
  },
  {
   "action": "expect",
   "assert": "visible",
   "target": {
    "role": "link",
    "name": "\uf13d Edit Profile Settings"
   }
  },
  {
   "action": "expect",
   "assert": "visible",
   "target": {
    "role": "listitem"
   }
  },
  {
   "action": "expect",
   "assert": "visible",
   "target": {
    "role": "listitem"
   }
  }
 ],
 "flow": "As alice, change her bio in settings to some generated text; her profile page then shows that bio."
}